<?xml version='1.0' encoding='UTF-8'?>
<!DOCTYPE employeesList [
<!ELEMENT employee ( id, firstname, lastname, position )>
<!ELEMENT id (#PCDATA)>
<!ELEMENT firstname (#PCDATA)>
<!ELEMENT lastname (#PCDATA)>
<!ELEMENT position ( id, name, description )>
<!ELEMENT id (#PCDATA)>
<!ELEMENT name (#PCDATA)>
<!ELEMENT description (#PCDATA)>
<!ATTLIST id type CDATA #REQUIRED>
]>

<employeesList>
    <employee>
        <id>1</id>
        <firstname>Steve</firstname>
        <lastname>Richards</lastname>
        <position>
            <id type="String">DIS_1</id>
            <name>test</name>
            <description>test</description>
        </position>
    </employee>
    <employee>
        <id>2</id>
        <firstname>Steve</firstname>
        <lastname>Richards</lastname>
        <position>
            <id type="String">DIS_1</id>
            <name>test</name>
            <description>test</description>
        </position>
    </employee>
    <employee>
        <id>3</id>
        <firstname>Steve</firstname>
        <lastname>Richards</lastname>
        <position>
            <id type="String">DIS_1</id>
            <name>test</name>
            <description>test</description>
        </position>
    </employee>
    <employee>
        <id>4</id>
        <firstname>Steve</firstname>
        <lastname>Richards</lastname>
        <position>
            <id type="String">DIS_1</id>
            <name>test</name>
            <description>test</description>
        </position>
    </employee>
    <employee>
        <id>5</id>
        <firstname>Steve</firstname>
        <lastname>Richards</lastname>
        <position>
            <id type="String">DIS_1</id>
            <name>test</name>
            <description>test</description>
        </position>
    </employee>
    <employee>
        <id>6</id>
        <firstname>Steve</firstname>
        <lastname>Richards</lastname>
        <position>
            <id type="String">DIS_1</id>
            <name>test</name>
            <description>test</description>
        </position>
    </employee>
    <employee>
        <id>7</id>
        <firstname>Steve</firstname>
        <lastname>Richards</lastname>
        <position>
            <id type="String">DIS_1</id>
            <name>test</name>
            <description>test</description>
        </position>
    </employee>
    <employee>
        <id>8</id>
        <firstname>Steve</firstname>
        <lastname>Richards</lastname>
        <position>
            <id type="String">DIS_1</id>
            <name>test</name>
            <description>test</description>
        </position>
    </employee>
    <employee>
        <id>9</id>
        <firstname>Steve</firstname>
        <lastname>Richards</lastname>
        <position>
            <id type="String">DIS_1</id>
            <name>test</name>
            <description>test</description>
        </position>
    </employee>
    <employee>
        <id>10</id>
        <firstname>Steve</firstname>
        <lastname>Richards</lastname>
        <position>
            <id type="String">DIS_1</id>
            <name>test</name>
            <description>test</description>
        </position>
    </employee>
    <employee>
        <id>11</id>
        <firstname>Steve</firstname>
        <lastname>Richards</lastname>
        <position>
            <id type="String">DIS_1</id>
            <name>test</name>
            <description>test</description>
        </position>
    </employee>
    <employee>
        <id>12</id>
        <firstname>Steve</firstname>
        <lastname>Richards</lastname>
        <position>
            <id type="String">DIS_1</id>
            <name>test</name>
            <description>test</description>
        </position>
    </employee>
    <employee>
        <id>13</id>
        <firstname>Steve</firstname>
        <lastname>Richards</lastname>
        <position>
            <id type="String">DIS_1</id>
            <name>test</name>
            <description>test</description>
        </position>
    </employee>
    <employee>
        <id>14</id>
        <firstname>Steve</firstname>
        <lastname>Richards</lastname>
        <position>
            <id type="String">DIS_1</id>
            <name>test</name>
            <description>test</description>
        </position>
    </employee>
    <employee>
        <id>15</id>
        <firstname>Steve</firstname>
        <lastname>Richards</lastname>
        <position>
            <id type="String">DIS_1</id>
            <name>test</name>
            <description>test</description>
        </position>
    </employee>
    <employee>
        <id>17</id>
        <firstname>Steve</firstname>
        <lastname>Richards</lastname>
        <position>
            <id type="String">DIS_1</id>
            <name>test</name>
            <description>test</description>
        </position>
    </employee>
    <employee>
        <id>16</id>
        <firstname>Steve</firstname>
        <lastname>Richards</lastname>
        <position>
            <id type="String">DIS_1</id>
            <name>test</name>
            <description>test</description>
        </position>
    </employee>
    <employee>
        <id>19</id>
        <firstname>Steve</firstname>
        <lastname>Richards</lastname>
        <position>
            <id type="String">DIS_1</id>
            <name>test</name>
            <description>test</description>
        </position>
    </employee>
    <employee>
        <id>18</id>
        <firstname>Steve</firstname>
        <lastname>Richards</lastname>
        <position>
            <id type="String">DIS_1</id>
            <name>test</name>
            <description>test</description>
        </position>
    </employee>
    <employee>
        <id>21</id>
        <firstname>Steve</firstname>
        <lastname>Richards</lastname>
        <position>
            <id type="String">DIS_1</id>
            <name>test</name>
            <description>test</description>
        </position>
    </employee>
    <employee>
        <id>20</id>
        <firstname>Steve</firstname>
        <lastname>Richards</lastname>
        <position>
            <id type="String">DIS_1</id>
            <name>test</name>
            <description>test</description>
        </position>
    </employee>
    <employee>
        <id>23</id>
        <firstname>Steve</firstname>
        <lastname>Richards</lastname>
        <position>
            <id type="String">DIS_1</id>
            <name>test</name>
            <description>test</description>
        </position>
    </employee>
    <employee>
        <id>22</id>
        <firstname>Steve</firstname>
        <lastname>Richards</lastname>
        <position>
            <id type="String">DIS_1</id>
            <name>test</name>
            <description>test</description>
        </position>
    </employee>
    <employee>
        <id>25</id>
        <firstname>Steve</firstname>
        <lastname>Richards</lastname>
        <position>
            <id type="String">DIS_1</id>
            <name>test</name>
            <description>test</description>
        </position>
    </employee>
    <employee>
        <id>24</id>
        <firstname>Steve</firstname>
        <lastname>Richards</lastname>
        <position>
            <id type="String">DIS_1</id>
            <name>test</name>
            <description>test</description>
        </position>
    </employee>
    <employee>
        <id>27</id>
        <firstname>Steve</firstname>
        <lastname>Richards</lastname>
        <position>
            <id type="String">DIS_1</id>
            <name>test</name>
            <description>test</description>
        </position>
    </employee>
    <employee>
        <id>26</id>
        <firstname>Steve</firstname>
        <lastname>Richards</lastname>
        <position>
            <id type="String">DIS_1</id>
            <name>test</name>
            <description>test</description>
        </position>
    </employee>
    <employee>
        <id>29</id>
        <firstname>Steve</firstname>
        <lastname>Richards</lastname>
        <position>
            <id type="String">DIS_1</id>
            <name>test</name>
            <description>test</description>
        </position>
    </employee>
    <employee>
        <id>28</id>
        <firstname>Steve</firstname>
        <lastname>Richards</lastname>
        <position>
            <id type="String">DIS_1</id>
            <name>test</name>
            <description>test</description>
        </position>
    </employee>
    <employee>
        <id>31</id>
        <firstname>Steve</firstname>
        <lastname>Richards</lastname>
        <position>
            <id type="String">DIS_1</id>
            <name>test</name>
            <description>test</description>
        </position>
    </employee>
    <employee>
        <id>30</id>
        <firstname>Steve</firstname>
        <lastname>Richards</lastname>
        <position>
            <id type="String">DIS_1</id>
            <name>test</name>
            <description>test</description>
        </position>
    </employee>
    <employee>
        <id>34</id>
        <firstname>Steve</firstname>
        <lastname>Richards</lastname>
        <position>
            <id type="String">DIS_1</id>
            <name>test</name>
            <description>test</description>
        </position>
    </employee>
    <employee>
        <id>35</id>
        <firstname>Steve</firstname>
        <lastname>Richards</lastname>
        <position>
            <id type="String">DIS_1</id>
            <name>test</name>
            <description>test</description>
        </position>
    </employee>
    <employee>
        <id>32</id>
        <firstname>Steve</firstname>
        <lastname>Richards</lastname>
        <position>
            <id type="String">DIS_1</id>
            <name>test</name>
            <description>test</description>
        </position>
    </employee>
    <employee>
        <id>33</id>
        <firstname>Steve</firstname>
        <lastname>Richards</lastname>
        <position>
            <id type="String">DIS_1</id>
            <name>test</name>
            <description>test</description>
        </position>
    </employee>
    <employee>
        <id>38</id>
        <firstname>Steve</firstname>
        <lastname>Richards</lastname>
        <position>
            <id type="String">DIS_1</id>
            <name>test</name>
            <description>test</description>
        </position>
    </employee>
    <employee>
        <id>39</id>
        <firstname>Steve</firstname>
        <lastname>Richards</lastname>
        <position>
            <id type="String">DIS_1</id>
            <name>test</name>
            <description>test</description>
        </position>
    </employee>
    <employee>
        <id>36</id>
        <firstname>Steve</firstname>
        <lastname>Richards</lastname>
        <position>
            <id type="String">DIS_1</id>
            <name>test</name>
            <description>test</description>
        </position>
    </employee>
    <employee>
        <id>37</id>
        <firstname>Steve</firstname>
        <lastname>Richards</lastname>
        <position>
            <id type="String">DIS_1</id>
            <name>test</name>
            <description>test</description>
        </position>
    </employee>
    <employee>
        <id>42</id>
        <firstname>Steve</firstname>
        <lastname>Richards</lastname>
        <position>
            <id type="String">DIS_1</id>
            <name>test</name>
            <description>test</description>
        </position>
    </employee>
    <employee>
        <id>43</id>
        <firstname>Steve</firstname>
        <lastname>Richards</lastname>
        <position>
            <id type="String">DIS_1</id>
            <name>test</name>
            <description>test</description>
        </position>
    </employee>
    <employee>
        <id>40</id>
        <firstname>Steve</firstname>
        <lastname>Richards</lastname>
        <position>
            <id type="String">DIS_1</id>
            <name>test</name>
            <description>test</description>
        </position>
    </employee>
    <employee>
        <id>41</id>
        <firstname>Steve</firstname>
        <lastname>Richards</lastname>
        <position>
            <id type="String">DIS_1</id>
            <name>test</name>
            <description>test</description>
        </position>
    </employee>
    <employee>
        <id>46</id>
        <firstname>Steve</firstname>
        <lastname>Richards</lastname>
        <position>
            <id type="String">DIS_1</id>
            <name>test</name>
            <description>test</description>
        </position>
    </employee>
    <employee>
        <id>47</id>
        <firstname>Steve</firstname>
        <lastname>Richards</lastname>
        <position>
            <id type="String">DIS_1</id>
            <name>test</name>
            <description>test</description>
        </position>
    </employee>
    <employee>
        <id>44</id>
        <firstname>Steve</firstname>
        <lastname>Richards</lastname>
        <position>
            <id type="String">DIS_1</id>
            <name>test</name>
            <description>test</description>
        </position>
    </employee>
    <employee>
        <id>45</id>
        <firstname>Steve</firstname>
        <lastname>Richards</lastname>
        <position>
            <id type="String">DIS_1</id>
            <name>test</name>
            <description>test</description>
        </position>
    </employee>
    <employee>
        <id>51</id>
        <firstname>Steve</firstname>
        <lastname>Richards</lastname>
        <position>
            <id type="String">DIS_1</id>
            <name>test</name>
            <description>test</description>
        </position>
    </employee>
    <employee>
        <id>50</id>
        <firstname>Steve</firstname>
        <lastname>Richards</lastname>
        <position>
            <id type="String">DIS_1</id>
            <name>test</name>
            <description>test</description>
        </position>
    </employee>
    <employee>
        <id>49</id>
        <firstname>Steve</firstname>
        <lastname>Richards</lastname>
        <position>
            <id type="String">DIS_1</id>
            <name>test</name>
            <description>test</description>
        </position>
    </employee>
    <employee>
        <id>48</id>
        <firstname>Steve</firstname>
        <lastname>Richards</lastname>
        <position>
            <id type="String">DIS_1</id>
            <name>test</name>
            <description>test</description>
        </position>
    </employee>
    <employee>
        <id>55</id>
        <firstname>Steve</firstname>
        <lastname>Richards</lastname>
        <position>
            <id type="String">DIS_1</id>
            <name>test</name>
            <description>test</description>
        </position>
    </employee>
    <employee>
        <id>54</id>
        <firstname>Steve</firstname>
        <lastname>Richards</lastname>
        <position>
            <id type="String">DIS_1</id>
            <name>test</name>
            <description>test</description>
        </position>
    </employee>
    <employee>
        <id>53</id>
        <firstname>Steve</firstname>
        <lastname>Richards</lastname>
        <position>
            <id type="String">DIS_1</id>
            <name>test</name>
            <description>test</description>
        </position>
    </employee>
    <employee>
        <id>52</id>
        <firstname>Steve</firstname>
        <lastname>Richards</lastname>
        <position>
            <id type="String">DIS_1</id>
            <name>test</name>
            <description>test</description>
        </position>
    </employee>
    <employee>
        <id>59</id>
        <firstname>Steve</firstname>
        <lastname>Richards</lastname>
        <position>
            <id type="String">DIS_1</id>
            <name>test</name>
            <description>test</description>
        </position>
    </employee>
    <employee>
        <id>58</id>
        <firstname>Steve</firstname>
        <lastname>Richards</lastname>
        <position>
            <id type="String">DIS_1</id>
            <name>test</name>
            <description>test</description>
        </position>
    </employee>
    <employee>
        <id>57</id>
        <firstname>Steve</firstname>
        <lastname>Richards</lastname>
        <position>
            <id type="String">DIS_1</id>
            <name>test</name>
            <description>test</description>
        </position>
    </employee>
    <employee>
        <id>56</id>
        <firstname>Steve</firstname>
        <lastname>Richards</lastname>
        <position>
            <id type="String">DIS_1</id>
            <name>test</name>
            <description>test</description>
        </position>
    </employee>
    <employee>
        <id>63</id>
        <firstname>Steve</firstname>
        <lastname>Richards</lastname>
        <position>
            <id type="String">DIS_1</id>
            <name>test</name>
            <description>test</description>
        </position>
    </employee>
    <employee>
        <id>62</id>
        <firstname>Steve</firstname>
        <lastname>Richards</lastname>
        <position>
            <id type="String">DIS_1</id>
            <name>test</name>
            <description>test</description>
        </position>
    </employee>
    <employee>
        <id>61</id>
        <firstname>Steve</firstname>
        <lastname>Richards</lastname>
        <position>
            <id type="String">DIS_1</id>
            <name>test</name>
            <description>test</description>
        </position>
    </employee>
    <employee>
        <id>60</id>
        <firstname>Steve</firstname>
        <lastname>Richards</lastname>
        <position>
            <id type="String">DIS_1</id>
            <name>test</name>
            <description>test</description>
        </position>
    </employee>
    <employee>
        <id>68</id>
        <firstname>Steve</firstname>
        <lastname>Richards</lastname>
        <position>
            <id type="String">DIS_1</id>
            <name>test</name>
            <description>test</description>
        </position>
    </employee>
    <employee>
        <id>69</id>
        <firstname>Steve</firstname>
        <lastname>Richards</lastname>
        <position>
            <id type="String">DIS_1</id>
            <name>test</name>
            <description>test</description>
        </position>
    </employee>
    <employee>
        <id>70</id>
        <firstname>Steve</firstname>
        <lastname>Richards</lastname>
        <position>
            <id type="String">DIS_1</id>
            <name>test</name>
            <description>test</description>
        </position>
    </employee>
    <employee>
        <id>71</id>
        <firstname>Steve</firstname>
        <lastname>Richards</lastname>
        <position>
            <id type="String">DIS_1</id>
            <name>test</name>
            <description>test</description>
        </position>
    </employee>
    <employee>
        <id>64</id>
        <firstname>Steve</firstname>
        <lastname>Richards</lastname>
        <position>
            <id type="String">DIS_1</id>
            <name>test</name>
            <description>test</description>
        </position>
    </employee>
    <employee>
        <id>65</id>
        <firstname>Steve</firstname>
        <lastname>Richards</lastname>
        <position>
            <id type="String">DIS_1</id>
            <name>test</name>
            <description>test</description>
        </position>
    </employee>
    <employee>
        <id>66</id>
        <firstname>Steve</firstname>
        <lastname>Richards</lastname>
        <position>
            <id type="String">DIS_1</id>
            <name>test</name>
            <description>test</description>
        </position>
    </employee>
    <employee>
        <id>67</id>
        <firstname>Steve</firstname>
        <lastname>Richards</lastname>
        <position>
            <id type="String">DIS_1</id>
            <name>test</name>
            <description>test</description>
        </position>
    </employee>
    <employee>
        <id>76</id>
        <firstname>Steve</firstname>
        <lastname>Richards</lastname>
        <position>
            <id type="String">DIS_1</id>
            <name>test</name>
            <description>test</description>
        </position>
    </employee>
    <employee>
        <id>77</id>
        <firstname>Steve</firstname>
        <lastname>Richards</lastname>
        <position>
            <id type="String">DIS_1</id>
            <name>test</name>
            <description>test</description>
        </position>
    </employee>
    <employee>
        <id>78</id>
        <firstname>Steve</firstname>
        <lastname>Richards</lastname>
        <position>
            <id type="String">DIS_1</id>
            <name>test</name>
            <description>test</description>
        </position>
    </employee>
    <employee>
        <id>79</id>
        <firstname>Steve</firstname>
        <lastname>Richards</lastname>
        <position>
            <id type="String">DIS_1</id>
            <name>test</name>
            <description>test</description>
        </position>
    </employee>
    <employee>
        <id>72</id>
        <firstname>Steve</firstname>
        <lastname>Richards</lastname>
        <position>
            <id type="String">DIS_1</id>
            <name>test</name>
            <description>test</description>
        </position>
    </employee>
    <employee>
        <id>73</id>
        <firstname>Steve</firstname>
        <lastname>Richards</lastname>
        <position>
            <id type="String">DIS_1</id>
            <name>test</name>
            <description>test</description>
        </position>
    </employee>
    <employee>
        <id>74</id>
        <firstname>Steve</firstname>
        <lastname>Richards</lastname>
        <position>
            <id type="String">DIS_1</id>
            <name>test</name>
            <description>test</description>
        </position>
    </employee>
    <employee>
        <id>75</id>
        <firstname>Steve</firstname>
        <lastname>Richards</lastname>
        <position>
            <id type="String">DIS_1</id>
            <name>test</name>
            <description>test</description>
        </position>
    </employee>
    <employee>
        <id>85</id>
        <firstname>Steve</firstname>
        <lastname>Richards</lastname>
        <position>
            <id type="String">DIS_1</id>
            <name>test</name>
            <description>test</description>
        </position>
    </employee>
    <employee>
        <id>84</id>
        <firstname>Steve</firstname>
        <lastname>Richards</lastname>
        <position>
            <id type="String">DIS_1</id>
            <name>test</name>
            <description>test</description>
        </position>
    </employee>
    <employee>
        <id>87</id>
        <firstname>Steve</firstname>
        <lastname>Richards</lastname>
        <position>
            <id type="String">DIS_1</id>
            <name>test</name>
            <description>test</description>
        </position>
    </employee>
    <employee>
        <id>86</id>
        <firstname>Steve</firstname>
        <lastname>Richards</lastname>
        <position>
            <id type="String">DIS_1</id>
            <name>test</name>
            <description>test</description>
        </position>
    </employee>
    <employee>
        <id>81</id>
        <firstname>Steve</firstname>
        <lastname>Richards</lastname>
        <position>
            <id type="String">DIS_1</id>
            <name>test</name>
            <description>test</description>
        </position>
    </employee>
    <employee>
        <id>80</id>
        <firstname>Steve</firstname>
        <lastname>Richards</lastname>
        <position>
            <id type="String">DIS_1</id>
            <name>test</name>
            <description>test</description>
        </position>
    </employee>
    <employee>
        <id>83</id>
        <firstname>Steve</firstname>
        <lastname>Richards</lastname>
        <position>
            <id type="String">DIS_1</id>
            <name>test</name>
            <description>test</description>
        </position>
    </employee>
    <employee>
        <id>82</id>
        <firstname>Steve</firstname>
        <lastname>Richards</lastname>
        <position>
            <id type="String">DIS_1</id>
            <name>test</name>
            <description>test</description>
        </position>
    </employee>
    <employee>
        <id>93</id>
        <firstname>Steve</firstname>
        <lastname>Richards</lastname>
        <position>
            <id type="String">DIS_1</id>
            <name>test</name>
            <description>test</description>
        </position>
    </employee>
    <employee>
        <id>92</id>
        <firstname>Steve</firstname>
        <lastname>Richards</lastname>
        <position>
            <id type="String">DIS_1</id>
            <name>test</name>
            <description>test</description>
        </position>
    </employee>
    <employee>
        <id>95</id>
        <firstname>Steve</firstname>
        <lastname>Richards</lastname>
        <position>
            <id type="String">DIS_1</id>
            <name>test</name>
            <description>test</description>
        </position>
    </employee>
    <employee>
        <id>94</id>
        <firstname>Steve</firstname>
        <lastname>Richards</lastname>
        <position>
            <id type="String">DIS_1</id>
            <name>test</name>
            <description>test</description>
        </position>
    </employee>
    <employee>
        <id>89</id>
        <firstname>Steve</firstname>
        <lastname>Richards</lastname>
        <position>
            <id type="String">DIS_1</id>
            <name>test</name>
            <description>test</description>
        </position>
    </employee>
    <employee>
        <id>88</id>
        <firstname>Steve</firstname>
        <lastname>Richards</lastname>
        <position>
            <id type="String">DIS_1</id>
            <name>test</name>
            <description>test</description>
        </position>
    </employee>
    <employee>
        <id>91</id>
        <firstname>Steve</firstname>
        <lastname>Richards</lastname>
        <position>
            <id type="String">DIS_1</id>
            <name>test</name>
            <description>test</description>
        </position>
    </employee>
    <employee>
        <id>90</id>
        <firstname>Steve</firstname>
        <lastname>Richards</lastname>
        <position>
            <id type="String">DIS_1</id>
            <name>test</name>
            <description>test</description>
        </position>
    </employee>
    <employee>
        <id>102</id>
        <firstname>Steve</firstname>
        <lastname>Richards</lastname>
        <position>
            <id type="String">DIS_1</id>
            <name>test</name>
            <description>test</description>
        </position>
    </employee>
    <employee>
        <id>103</id>
        <firstname>Steve</firstname>
        <lastname>Richards</lastname>
        <position>
            <id type="String">DIS_1</id>
            <name>test</name>
            <description>test</description>
        </position>
    </employee>
    <employee>
        <id>100</id>
        <firstname>Steve</firstname>
        <lastname>Richards</lastname>
        <position>
            <id type="String">DIS_1</id>
            <name>test</name>
            <description>test</description>
        </position>
    </employee>
    <employee>
        <id>101</id>
        <firstname>Steve</firstname>
        <lastname>Richards</lastname>
        <position>
            <id type="String">DIS_1</id>
            <name>test</name>
            <description>test</description>
        </position>
    </employee>
    <employee>
        <id>98</id>
        <firstname>Steve</firstname>
        <lastname>Richards</lastname>
        <position>
            <id type="String">DIS_1</id>
            <name>test</name>
            <description>test</description>
        </position>
    </employee>
    <employee>
        <id>99</id>
        <firstname>Steve</firstname>
        <lastname>Richards</lastname>
        <position>
            <id type="String">DIS_1</id>
            <name>test</name>
            <description>test</description>
        </position>
    </employee>
    <employee>
        <id>96</id>
        <firstname>Steve</firstname>
        <lastname>Richards</lastname>
        <position>
            <id type="String">DIS_1</id>
            <name>test</name>
            <description>test</description>
        </position>
    </employee>
    <employee>
        <id>97</id>
        <firstname>Steve</firstname>
        <lastname>Richards</lastname>
        <position>
            <id type="String">DIS_1</id>
            <name>test</name>
            <description>test</description>
        </position>
    </employee>
    <employee>
        <id>110</id>
        <firstname>Steve</firstname>
        <lastname>Richards</lastname>
        <position>
            <id type="String">DIS_1</id>
            <name>test</name>
            <description>test</description>
        </position>
    </employee>
    <employee>
        <id>111</id>
        <firstname>Steve</firstname>
        <lastname>Richards</lastname>
        <position>
            <id type="String">DIS_1</id>
            <name>test</name>
            <description>test</description>
        </position>
    </employee>
    <employee>
        <id>108</id>
        <firstname>Steve</firstname>
        <lastname>Richards</lastname>
        <position>
            <id type="String">DIS_1</id>
            <name>test</name>